{
  "id": "ex-sc2-3",
  "nodeId": "sc2-n3",
  "blockId": "SC2",
  "type": "classification",
  "title": "Настроить повторы",
  "promptBlocks": [
    {
      "type": "paragraph",
      "text": "Для каждого вызова назначьте таймаут, число повторов и нужен ли размыкатель."
    },
    {
      "type": "paragraph",
      "text": "Проверка промокода при вводе 2. Списание с карты 3. Отправка уведомления магазину 4. Получение рейтинга для карточки"
    }
  ],
  "inputs": [
    {
      "id": "b1",
      "label": "Проверка промокода — размыкатель",
      "type": "choice",
      "choices": [
        "нужен",
        "не нужен"
      ]
    },
    {
      "id": "b2",
      "label": "Списание с карты — размыкатель",
      "type": "choice",
      "choices": [
        "нужен",
        "не нужен"
      ]
    },
    {
      "id": "b3",
      "label": "Уведомление магазину — размыкатель",
      "type": "choice",
      "choices": [
        "нужен",
        "не нужен"
      ]
    },
    {
      "id": "b4",
      "label": "Рейтинг для карточки — размыкатель",
      "type": "choice",
      "choices": [
        "нужен",
        "не нужен"
      ]
    }
  ],
  "acceptance": [
    {
      "inputId": "b1",
      "expected": "не нужен"
    },
    {
      "inputId": "b2",
      "expected": "не нужен"
    },
    {
      "inputId": "b3",
      "expected": "нужен"
    },
    {
      "inputId": "b4",
      "expected": "нужен"
    }
  ],
  "referenceReasoningBlocks": [
    {
      "type": "paragraph",
      "text": "1 — 2 с, без повторов, размыкатель не нужен: человек рядом. 2 — 10 с, 3 повтора с задержкой, размыкателя нет, критично. 3 — фоновое, до 10 попыток в течение часа, размыкатель есть. 4 — 500 мс, 1 повтор, размыкатель с низким порогом: сервис необязательный. Приём: если человек ждёт — короткие таймауты и мало повторов; если фоновое — важна доставка, а не скорость."
    }
  ],
  "estimatedMinutes": 8
}
