{
  "id": "ex-se3-1",
  "nodeId": "se3-n1",
  "blockId": "SE3",
  "type": "open",
  "title": "Перевести требование в архитектуру",
  "promptBlocks": [
    {
      "type": "paragraph",
      "text": "Для каждого юридического требования назовите техническое следствие."
    },
    {
      "type": "paragraph",
      "text": "Право на удаление 2. Минимизация данных 3. Защита по умолчанию 4. Уведомление об утечке за 72 часа 5. Локализация данных"
    }
  ],
  "inputs": [],
  "acceptance": [],
  "referenceReasoningBlocks": [
    {
      "type": "paragraph",
      "text": "1 — удаление по всем системам, карта данных, экспорт. 2 — аудит полей, сроки хранения. 3 — согласия не предвыбраны, необязательный сбор выключен, минимальная видимость. 4 — обнаружение, процедура оценки объёма, шаблоны, дежурство. 5 — география базы, копий, логов, кэшей, субпроцессоров и доступа сотрудников. Приём: за каждым юридическим требованием стоит конкретная техническая работа."
    }
  ],
  "estimatedMinutes": 8
}
