{
  "id": "ex-ds1-3",
  "nodeId": "ds1-n3",
  "blockId": "DS1",
  "type": "classification",
  "title": "Оценить миграцию",
  "promptBlocks": [
    {
      "type": "paragraph",
      "text": "Расставьте по возрастанию стоимости и укажите порядок величины (часы / дни / недели)."
    },
    {
      "type": "list",
      "items": [
        "A. Добавить необязательное поле «комментарий курьеру»",
        "B. Разрешить у заказа несколько адресов доставки",
        "C. Сделать поле «дата рождения» обязательным для новых пользователей",
        "D. Переименовать поле `price` в `price_at_purchase`"
      ]
    }
  ],
  "inputs": [
    {
      "id": "a",
      "label": "A. Необязательное поле «комментарий курьеру»",
      "type": "choice",
      "choices": [
        "часы",
        "дни",
        "недели"
      ]
    },
    {
      "id": "b",
      "label": "B. Несколько адресов доставки у заказа",
      "type": "choice",
      "choices": [
        "часы",
        "дни",
        "недели"
      ]
    },
    {
      "id": "c",
      "label": "C. Обязательная дата рождения для новых пользователей",
      "type": "choice",
      "choices": [
        "часы",
        "дни",
        "недели"
      ]
    },
    {
      "id": "d",
      "label": "D. Переименование `price` в `price_at_purchase`",
      "type": "choice",
      "choices": [
        "часы",
        "дни",
        "недели"
      ]
    }
  ],
  "acceptance": [
    {
      "inputId": "a",
      "expected": "часы"
    },
    {
      "inputId": "b",
      "expected": "недели"
    },
    {
      "inputId": "c",
      "expected": "дни"
    },
    {
      "inputId": "d",
      "expected": "дни"
    }
  ],
  "referenceReasoningBlocks": [
    {
      "type": "paragraph",
      "text": "A (часы) → C (дни) → D (дни) → B (недели). A не трогает старые записи. C требует продуктового решения о старых пользователях, но не бэкфилла. D живёт в двух версиях, пока не обновятся клиенты. B меняет кардинальность и задевает всё. Порядок C и D обсуждаем; важно, что оба на порядок дешевле B."
    }
  ],
  "estimatedMinutes": 8
}
