{
  "id": "ex-in1-3",
  "nodeId": "in1-n3",
  "blockId": "IN1",
  "type": "classification",
  "title": "Спроектировать ошибку",
  "promptBlocks": [
    {
      "type": "paragraph",
      "text": "Для каждого кода на экране оформления скажите: что показать, повторять ли автоматически, логировать ли как сбой."
    },
    {
      "type": "paragraph",
      "text": "`401` · `409` товар закончился · `422` адрес вне зоны · `429` · `503` · таймаут"
    }
  ],
  "inputs": [
    {
      "id": "c401",
      "label": "`401`",
      "type": "choice",
      "choices": [
        "повторять автоматически",
        "не повторять"
      ]
    },
    {
      "id": "c409",
      "label": "`409` товар закончился",
      "type": "choice",
      "choices": [
        "повторять автоматически",
        "не повторять"
      ]
    },
    {
      "id": "c422",
      "label": "`422` адрес вне зоны",
      "type": "choice",
      "choices": [
        "повторять автоматически",
        "не повторять"
      ]
    },
    {
      "id": "c429",
      "label": "`429`",
      "type": "choice",
      "choices": [
        "повторять автоматически",
        "не повторять"
      ]
    },
    {
      "id": "c503",
      "label": "`503`",
      "type": "choice",
      "choices": [
        "повторять автоматически",
        "не повторять"
      ]
    }
  ],
  "acceptance": [
    {
      "inputId": "c401",
      "expected": "не повторять"
    },
    {
      "inputId": "c409",
      "expected": "не повторять"
    },
    {
      "inputId": "c422",
      "expected": "не повторять"
    },
    {
      "inputId": "c429",
      "expected": "повторять автоматически"
    },
    {
      "inputId": "c503",
      "expected": "повторять автоматически"
    }
  ],
  "referenceReasoningBlocks": [
    {
      "type": "paragraph",
      "text": "`401` — на вход с сохранением корзины, не повторять, не сбой. `409` — «товара больше нет» с кнопкой убрать, не повторять, не сбой. `422` — сообщение у поля адреса, не повторять, не сбой. `429` — «слишком часто», повтор с задержкой, логировать как подозрительное. `503` — «перегружены», автоповтор, логировать как сбой. Таймаут — худший случай: неизвестно, прошло ли; повторять только при наличии ключа идемпотентности, показать «проверяем статус», логировать. Приём: сначала «может ли человек исправить сам», потом «безопасен ли повтор»."
    }
  ],
  "estimatedMinutes": 8
}
