{
  "id": "ex-pf2-1",
  "nodeId": "pf2-n1",
  "blockId": "PF2",
  "type": "estimation",
  "title": "Составить бюджет",
  "promptBlocks": [
    {
      "type": "paragraph",
      "text": "Цель для экрана каталога — 1.2 с на p95. Известно: соединение уже установлено, RTT 120 мс, отрисовка 200 мс, передача ответа 150 мс. Разложите оставшееся по серверным вызовам: каталог, остатки, цены, баннеры — и скажите, что параллельно."
    }
  ],
  "inputs": [
    {
      "id": "budget",
      "label": "Бюджет на серверную часть после резерва",
      "type": "number",
      "unit": "мс"
    },
    {
      "id": "path",
      "label": "Критический путь",
      "type": "number",
      "unit": "мс"
    }
  ],
  "acceptance": [
    {
      "inputId": "budget",
      "min": 600,
      "max": 740
    },
    {
      "inputId": "path",
      "min": 540,
      "max": 640
    }
  ],
  "referenceReasoningBlocks": [
    {
      "type": "paragraph",
      "text": "остаётся 1 200 − 120 − 200 − 150 = 730 мс на сервер, минус резерв 15% (110 мс) = 620 мс. Каталог, цены и баннеры независимы — параллельно. Остатки зависят от списка товаров из каталога — последовательно после него. Критический путь: каталог (300) + остатки (250) + сборка (40) = 590 мс. Цены и баннеры укладываются в параллельные 300 мс. Резерв 30 мс — маловат, стоит ужать каталог."
    }
  ],
  "estimatedMinutes": 8
}
