{
  "id": "ex-sc2-6",
  "nodeId": "sc2-n6",
  "blockId": "SC2",
  "type": "open",
  "title": "Разобрать постмортем",
  "promptBlocks": [
    {
      "type": "paragraph",
      "text": "Инцидент: 40 минут недоступности. Началось в 14:02, обнаружено в 14:31 по жалобам в поддержку, причина найдена в 14:38, починено в 14:42. Причина — исчерпание места на диске из-за роста логов."
    },
    {
      "type": "paragraph",
      "text": "Назовите три вывода, которых нет в формулировке «добавить места на диске»."
    }
  ],
  "inputs": [],
  "acceptance": [],
  "referenceReasoningBlocks": [
    {
      "type": "paragraph",
      "text": "время обнаружения 29 минут против 11 на устранение — главная проблема не в починке, а в отсутствии мониторинга дискового пространства. Обнаружение по жалобам пользователей означает, что автоматических оповещений нет вовсе, и это относится не только к диску. Рост логов — симптом: нет ротации и нет срока хранения, что связано с retention из `DS2-N6`. Приём: спрашивайте о классе проблемы, а не о случае."
    }
  ],
  "estimatedMinutes": 8
}
