{
  "id": "ex-ds2-6",
  "nodeId": "ds2-n6",
  "blockId": "DS2",
  "type": "classification",
  "title": "Что реально удаляется",
  "promptBlocks": [
    {
      "type": "paragraph",
      "text": "Пользователь удалил аккаунт. Отметьте, что исчезнет немедленно, что в течение месяца, что останется навсегда: профиль, телефон в логах доставки, заказы в аналитическом хранилище, платёжные документы, отзывы, данные в резервной копии, запись у службы доставки."
    }
  ],
  "inputs": [
    {
      "id": "p1",
      "label": "Профиль",
      "type": "choice",
      "choices": [
        "немедленно",
        "в течение суток",
        "в течение месяца",
        "навсегда",
        "вне нашего контроля"
      ]
    },
    {
      "id": "p2",
      "label": "Отзывы",
      "type": "choice",
      "choices": [
        "немедленно",
        "в течение суток",
        "в течение месяца",
        "навсегда",
        "вне нашего контроля"
      ]
    },
    {
      "id": "p3",
      "label": "Заказы в аналитическом хранилище",
      "type": "choice",
      "choices": [
        "немедленно",
        "в течение суток",
        "в течение месяца",
        "навсегда",
        "вне нашего контроля"
      ]
    },
    {
      "id": "p4",
      "label": "Данные в резервной копии",
      "type": "choice",
      "choices": [
        "немедленно",
        "в течение суток",
        "в течение месяца",
        "навсегда",
        "вне нашего контроля"
      ]
    },
    {
      "id": "p5",
      "label": "Платёжные документы",
      "type": "choice",
      "choices": [
        "немедленно",
        "в течение суток",
        "в течение месяца",
        "навсегда",
        "вне нашего контроля"
      ]
    },
    {
      "id": "p6",
      "label": "Запись у службы доставки",
      "type": "choice",
      "choices": [
        "немедленно",
        "в течение суток",
        "в течение месяца",
        "навсегда",
        "вне нашего контроля"
      ]
    }
  ],
  "acceptance": [
    {
      "inputId": "p1",
      "expected": "немедленно"
    },
    {
      "inputId": "p2",
      "expected": "немедленно"
    },
    {
      "inputId": "p3",
      "expected": "в течение суток"
    },
    {
      "inputId": "p4",
      "expected": "в течение месяца"
    },
    {
      "inputId": "p5",
      "expected": "навсегда"
    },
    {
      "inputId": "p6",
      "expected": "вне нашего контроля"
    }
  ],
  "referenceReasoningBlocks": [
    {
      "type": "paragraph",
      "text": "немедленно — профиль, отзывы обезличиваются. Сутки — аналитическое хранилище. Месяц — резервные копии по истечении срока. Навсегда — платёжные документы по закону, обезличенные факты покупок. Вне нашего контроля — запись у службы доставки, регулируется её политикой. Телефон в логах — ловушка: правильный ответ не «удалить», а «не допускать попадания». Обещание в интерфейсе должно описывать именно это, а не «удалим всё»."
    }
  ],
  "estimatedMinutes": 8
}
