{
  "id": "ex-ds2-4",
  "nodeId": "ds2-n4",
  "blockId": "DS2",
  "type": "open",
  "title": "Какой цифре верить",
  "promptBlocks": [
    {
      "type": "paragraph",
      "text": "Продукт: 20 148 заказов вчера. Дашборд: 20 106. Назовите три вероятные причины и скажите, какая цифра идёт в квартальный отчёт партнёрам."
    }
  ],
  "inputs": [],
  "acceptance": [],
  "referenceReasoningBlocks": [
    {
      "type": "paragraph",
      "text": "причины — задержка выгрузки; разные определения (аналитика исключает отменённые и тестовые); граница суток по разным полям. В отчёт идёт цифра из хранилища: она воспроизводима, тот же запрос через месяц даст то же число. Продуктовая база меняется под руками, и повторный отчёт из неё будет другим. Требовать совпадения бессмысленно — требовать надо знания разницы."
    }
  ],
  "estimatedMinutes": 8
}
