{
  "id": "ex-in2-2",
  "nodeId": "in2-n2",
  "blockId": "IN2",
  "type": "classification",
  "title": "Ломает или нет",
  "promptBlocks": [
    {
      "type": "paragraph",
      "text": "Отметьте ломающие изменения."
    },
    {
      "type": "list",
      "items": [
        "Добавить поле `delivery_eta` в ответ",
        "Переименовать `price` в `price_gross`",
        "Добавить статус `собирается` к трём существующим",
        "Сделать `comment` необязательным",
        "Изменить `order_id` с числа на строку",
        "Начать считать `total` с учётом доставки, а не без"
      ],
      "ordered": true
    }
  ],
  "inputs": [
    {
      "id": "c1",
      "label": "Добавить поле `delivery_eta` в ответ",
      "type": "choice",
      "choices": [
        "ломает",
        "не ломает"
      ]
    },
    {
      "id": "c2",
      "label": "Переименовать `price` в `price_gross`",
      "type": "choice",
      "choices": [
        "ломает",
        "не ломает"
      ]
    },
    {
      "id": "c4",
      "label": "Сделать `comment` необязательным",
      "type": "choice",
      "choices": [
        "ломает",
        "не ломает"
      ]
    },
    {
      "id": "c5",
      "label": "Изменить `order_id` с числа на строку",
      "type": "choice",
      "choices": [
        "ломает",
        "не ломает"
      ]
    },
    {
      "id": "c6",
      "label": "Считать `total` с учётом доставки",
      "type": "choice",
      "choices": [
        "ломает",
        "не ломает"
      ]
    }
  ],
  "acceptance": [
    {
      "inputId": "c1",
      "expected": "не ломает"
    },
    {
      "inputId": "c2",
      "expected": "ломает"
    },
    {
      "inputId": "c4",
      "expected": "не ломает"
    },
    {
      "inputId": "c5",
      "expected": "ломает"
    },
    {
      "inputId": "c6",
      "expected": "ломает"
    }
  ],
  "referenceReasoningBlocks": [
    {
      "type": "paragraph",
      "text": "ломают 2, 5, 6 — и 3 условно. 6 самое опасное: формат прежний, смысл другой, ничего не падает, расхождения обнаружатся в отчётах партнёров через недели. 3 ломает только нетолерантных клиентов — на «Полке» ровно это и случилось. 1 и 4 безопасны. Приём: спросите не «поменяется ли структура», а «сможет ли существующий клиент работать как раньше»."
    }
  ],
  "estimatedMinutes": 8
}
