{
  "id": "ex-se3-2",
  "nodeId": "se3-n1",
  "blockId": "SE3",
  "type": "open",
  "title": "Проверить цепочку локализации",
  "promptBlocks": [
    {
      "type": "paragraph",
      "text": "Клиент требует хранения в стране. Перечислите семь мест, которые надо проверить, и назовите три, о которых обычно забывают."
    }
  ],
  "inputs": [],
  "acceptance": [],
  "referenceReasoningBlocks": [
    {
      "type": "paragraph",
      "text": "основная база, резервные копии, аналитическое хранилище, логи, CDN и кэши, субпроцессоры, доступ сотрудников. Забывают: копии (часто в другом регионе для надёжности), логи (у стороннего сервиса), доступ сотрудников из другой страны. Последнее — самое частое фактическое нарушение при формальном соответствии."
    }
  ],
  "estimatedMinutes": 8
}
