{
  "id": "ex-sc3-1",
  "nodeId": "sc3-n1",
  "blockId": "SC3",
  "type": "open",
  "title": "Вывести цель",
  "promptBlocks": [
    {
      "type": "paragraph",
      "text": "Для каждого сценария ответьте на три вопроса и предложите цель."
    },
    {
      "type": "list",
      "items": [
        "Оформление заказа в сервисе доставки еды",
        "Просмотр архива статей в медиа",
        "Отправка платежа в банке",
        "Загрузка аватара в соцсети"
      ],
      "ordered": true
    }
  ],
  "inputs": [],
  "acceptance": [],
  "referenceReasoningBlocks": [
    {
      "type": "paragraph",
      "text": "1 — уходит к конкуренту, приходит часто, порог заметности низкий: 99.9%. 2 — ждёт или возвращается позже, приходит редко: 99% достаточно. 3 — деньги, доверие, невосполнимость: максимум, 99.95%+, и отдельно RPO ≈ 0. 4 — повторит сам, порог заметности высокий: 99%. Приём: что делает при отказе, как часто приходит, заметит ли вообще."
    }
  ],
  "estimatedMinutes": 8
}
