{
  "id": "ex-in3-5",
  "nodeId": "in3-n5",
  "blockId": "IN3",
  "type": "classification",
  "title": "Разобрать опросник",
  "promptBlocks": [
    {
      "type": "paragraph",
      "text": "Восемь пунктов от корпоративного клиента. Отсортируйте: есть / нет, дёшево / нет, дорого."
    },
    {
      "type": "list",
      "items": [
        "Двухфакторная аутентификация для сотрудников клиента",
        "Выгрузка всех данных при расторжении",
        "Данные хранятся в РФ",
        "Уведомление об утечке в течение 24 часов",
        "Единый вход через их корпоративный каталог",
        "Логи действий пользователей за 12 месяцев",
        "Список субпроцессоров с уведомлением об изменении",
        "SLA 99.9% с компенсацией"
      ],
      "ordered": true
    }
  ],
  "inputs": [
    {
      "id": "q1",
      "label": "Двухфакторная аутентификация",
      "type": "choice",
      "choices": [
        "дёшево",
        "дорого",
        "зависит от того, что уже есть"
      ]
    },
    {
      "id": "q2",
      "label": "Выгрузка всех данных при расторжении",
      "type": "choice",
      "choices": [
        "дёшево",
        "дорого",
        "зависит от того, что уже есть"
      ]
    },
    {
      "id": "q3",
      "label": "Хранение данных в РФ",
      "type": "choice",
      "choices": [
        "дёшево",
        "дорого",
        "зависит от того, что уже есть"
      ]
    },
    {
      "id": "q4",
      "label": "Уведомление об утечке за 24 часа",
      "type": "choice",
      "choices": [
        "дёшево",
        "дорого",
        "зависит от того, что уже есть"
      ]
    },
    {
      "id": "q5",
      "label": "Единый вход через корпоративный каталог",
      "type": "choice",
      "choices": [
        "дёшево",
        "дорого",
        "зависит от того, что уже есть"
      ]
    },
    {
      "id": "q6",
      "label": "Логи действий за 12 месяцев",
      "type": "choice",
      "choices": [
        "дёшево",
        "дорого",
        "зависит от того, что уже есть"
      ]
    },
    {
      "id": "q7",
      "label": "Список субпроцессоров",
      "type": "choice",
      "choices": [
        "дёшево",
        "дорого",
        "зависит от того, что уже есть"
      ]
    },
    {
      "id": "q8",
      "label": "SLA 99.9% с компенсацией",
      "type": "choice",
      "choices": [
        "дёшево",
        "дорого",
        "зависит от того, что уже есть"
      ]
    }
  ],
  "acceptance": [
    {
      "inputId": "q1",
      "expected": "зависит от того, что уже есть"
    },
    {
      "inputId": "q2",
      "expected": "дёшево"
    },
    {
      "inputId": "q3",
      "expected": "дорого"
    },
    {
      "inputId": "q4",
      "expected": "дёшево"
    },
    {
      "inputId": "q5",
      "expected": "дорого"
    },
    {
      "inputId": "q6",
      "expected": "зависит от того, что уже есть"
    },
    {
      "inputId": "q7",
      "expected": "дёшево"
    },
    {
      "inputId": "q8",
      "expected": "дорого"
    }
  ],
  "referenceReasoningBlocks": [
    {
      "type": "paragraph",
      "text": "дёшево — 2, 4 (процесс, не разработка), 7 (документ). Дорого — 3, 5, 8. Пункты 1 и 6 зависят от того, что уже есть: двухфакторная часто есть, логи действий с хранением 12 месяцев обычно нет и это средняя стоимость. Приём: отделите то, что является процессом или документом, от того, что требует разработки, — обычно треть пунктов закрывается без кода."
    }
  ],
  "estimatedMinutes": 8
}
