{
  "id": "ex-ds3-3",
  "nodeId": "ds3-n3",
  "blockId": "DS3",
  "type": "open",
  "title": "Выбрать модель изоляции",
  "promptBlocks": [
    {
      "type": "paragraph",
      "text": "Три сделки в переговорах. Для каждой скажите, какая модель нужна и что придётся продать отдельно."
    },
    {
      "type": "list",
      "items": [
        "Сеть из 40 магазинов, требует хранения данных в РФ и подтверждения изоляции от конкурентов",
        "200 одиночных магазинов, стандартные условия, чувствительны к цене",
        "Сеть из 12 магазинов, хочет свои коды складов и окно обновлений по субботам"
      ]
    }
  ],
  "inputs": [],
  "acceptance": [],
  "referenceReasoningBlocks": [
    {
      "type": "paragraph",
      "text": "первая — база на тенанта, резидентность выполнима только так; продаётся как корпоративный тариф. Вторая — общая схема, иначе экономика не сходится. Третья — общая схема плюс таблица расширений под коды складов; окно обновлений по субботам в общей схеме невыполнимо, это надо честно сказать и либо отказать, либо тоже выносить. Общий приём: требование клиента переводится в модель изоляции, а модель — в строчку прайса."
    }
  ],
  "estimatedMinutes": 8
}
