{
  "id": "ex-se1-1",
  "nodeId": "se1-n1",
  "blockId": "SE1",
  "type": "classification",
  "title": "Аутентификация или авторизация",
  "promptBlocks": [
    {
      "type": "paragraph",
      "text": "Для каждой ситуации: какая проблема и что показать."
    },
    {
      "type": "list",
      "items": [
        "Сессия истекла во время оформления",
        "Сотрудник магазина открывает отчёт по сети",
        "Пароль введён неверно",
        "Пользователь открывает чужой заказ по ссылке"
      ],
      "ordered": true
    }
  ],
  "inputs": [
    {
      "id": "c1",
      "label": "Сессия истекла во время оформления",
      "type": "choice",
      "choices": [
        "аутентификация",
        "авторизация"
      ]
    },
    {
      "id": "c2",
      "label": "Сотрудник магазина открывает отчёт по сети",
      "type": "choice",
      "choices": [
        "аутентификация",
        "авторизация"
      ]
    },
    {
      "id": "c3",
      "label": "Пароль введён неверно",
      "type": "choice",
      "choices": [
        "аутентификация",
        "авторизация"
      ]
    },
    {
      "id": "c4",
      "label": "Пользователь открывает чужой заказ по ссылке",
      "type": "choice",
      "choices": [
        "аутентификация",
        "авторизация"
      ]
    }
  ],
  "acceptance": [
    {
      "inputId": "c1",
      "expected": "аутентификация"
    },
    {
      "inputId": "c2",
      "expected": "авторизация"
    },
    {
      "inputId": "c3",
      "expected": "аутентификация"
    },
    {
      "inputId": "c4",
      "expected": "авторизация"
    }
  ],
  "referenceReasoningBlocks": [
    {
      "type": "paragraph",
      "text": "1 — аутентификация, `401`, вход с сохранением корзины. 2 — авторизация, `403`, объяснение «нужны права управляющего сети», вход не предлагать. 3 — аутентификация, сообщение без уточнения, что именно неверно. 4 — авторизация, `404` а не `403`: сообщать о существовании чужого заказа не нужно. Последнее — тонкость: иногда правильный ответ «не найдено» вместо «запрещено»."
    }
  ],
  "estimatedMinutes": 8
}
