{
  "id": "ex-in3-2",
  "nodeId": "in3-n2",
  "blockId": "IN3",
  "type": "classification",
  "title": "Оркестрация или события",
  "promptBlocks": [
    {
      "type": "paragraph",
      "text": "Распределите шаги оформления подписки."
    },
    {
      "type": "paragraph",
      "text": "Проверить карту 2. Создать подписку 3. Списать первый платёж 4. Открыть доступ к функциям 5. Отправить письмо 6. Начислить реферальный бонус 7. Обновить сегмент в CRM"
    }
  ],
  "inputs": [
    {
      "id": "s1",
      "label": "Проверить карту",
      "type": "choice",
      "choices": [
        "оркестрация",
        "события"
      ]
    },
    {
      "id": "s2",
      "label": "Создать подписку",
      "type": "choice",
      "choices": [
        "оркестрация",
        "события"
      ]
    },
    {
      "id": "s3",
      "label": "Списать первый платёж",
      "type": "choice",
      "choices": [
        "оркестрация",
        "события"
      ]
    },
    {
      "id": "s4",
      "label": "Открыть доступ к функциям",
      "type": "choice",
      "choices": [
        "оркестрация",
        "события"
      ]
    },
    {
      "id": "s5",
      "label": "Отправить письмо",
      "type": "choice",
      "choices": [
        "оркестрация",
        "события"
      ]
    },
    {
      "id": "s6",
      "label": "Начислить реферальный бонус",
      "type": "choice",
      "choices": [
        "оркестрация",
        "события"
      ]
    },
    {
      "id": "s7",
      "label": "Обновить сегмент в CRM",
      "type": "choice",
      "choices": [
        "оркестрация",
        "события"
      ]
    }
  ],
  "acceptance": [
    {
      "inputId": "s1",
      "expected": "оркестрация"
    },
    {
      "inputId": "s2",
      "expected": "оркестрация"
    },
    {
      "inputId": "s3",
      "expected": "оркестрация"
    },
    {
      "inputId": "s4",
      "expected": "оркестрация"
    },
    {
      "inputId": "s5",
      "expected": "события"
    },
    {
      "inputId": "s6",
      "expected": "события"
    },
    {
      "inputId": "s7",
      "expected": "события"
    }
  ],
  "referenceReasoningBlocks": [
    {
      "type": "paragraph",
      "text": "оркестрация 1–4 — без них подписка не считается оформленной, нужна транзакционность и немедленный результат для пользователя. События 5–7. Спорный пункт 4: если открытие доступа не мгновенно, человек платит и не получает — значит оркестрация. Критерий тот же, что для границы транзакции и границы синхронности: без чего действие не считается совершённым."
    }
  ],
  "estimatedMinutes": 8
}
