{
  "id": "ex-pf3-1",
  "nodeId": "pf3-n1",
  "blockId": "PF3",
  "type": "estimation",
  "title": "Построить модель затрат",
  "promptBlocks": [
    {
      "type": "paragraph",
      "text": "Счёт: вычисления 400 тыс., хранение 120 тыс., трафик 90 тыс., аналитика 60 тыс., SMS 180 тыс., эквайринг 620 тыс. Планируется рост аудитории вдвое при том же поведении."
    },
    {
      "type": "list",
      "items": [
        "К каким драйверам привязываются статьи?",
        "Каким станет счёт?",
        "Какая статья требует внимания первой?"
      ],
      "ordered": true
    }
  ],
  "inputs": [
    {
      "id": "bill",
      "label": "Счёт после роста аудитории вдвое",
      "type": "number",
      "unit": "млн ₽"
    }
  ],
  "acceptance": [
    {
      "inputId": "bill",
      "min": 2.6,
      "max": 3.2
    }
  ],
  "referenceReasoningBlocks": [
    {
      "type": "paragraph",
      "text": "вычисления, трафик, аналитика, SMS, эквайринг — к активным пользователям и транзакциям, растут вдвое. Хранение — к накопленному объёму, растёт быстрее чем вдвое, примерно в 2.3 раза. Счёт: примерно 2.9 млн вместо 1.47 млн. Внимания требует эквайринг — крупнейшая статья, линейная, не снижается с масштабом; рычаг переговорный, и начинать надо до роста, а не после."
    }
  ],
  "estimatedMinutes": 8
}
