{
  "id": "ex-ai2-3",
  "nodeId": "ai2-n3",
  "blockId": "AI2",
  "type": "estimation",
  "title": "Посчитать и удешевить",
  "promptBlocks": [
    {
      "type": "paragraph",
      "text": "Функция: вход 5 000 токенов, выход 400. Цена входа 15 ₽ за млн, выхода 60 ₽ за млн. Вызовов 8 000 в сутки. Из входа 3 200 токенов — неизменная инструкция и структура."
    },
    {
      "type": "list",
      "items": [
        "Годовая стоимость?",
        "Три рычага и эффект каждого."
      ],
      "ordered": true
    }
  ],
  "inputs": [
    {
      "id": "call",
      "label": "Стоимость одного вызова",
      "type": "number",
      "unit": "₽"
    },
    {
      "id": "year",
      "label": "Годовая стоимость",
      "type": "number",
      "unit": "тыс. ₽"
    }
  ],
  "acceptance": [
    {
      "inputId": "call",
      "min": 0.09,
      "max": 0.11
    },
    {
      "inputId": "year",
      "min": 250,
      "max": 330
    }
  ],
  "referenceReasoningBlocks": [
    {
      "type": "paragraph",
      "text": "вызов = 5 000×0.000015 + 400×0.00006 = 0.075 + 0.024 = 0.099 ₽. В год: 0.099 × 8 000 × 365 ≈ 289 тыс. ₽. Рычаги: кэширование промпта на 3 200 неизменных токенов — экономия примерно половины стоимости входа; сокращение найденного в контексте; проверка, зависит ли результат от пользователя — если нет, считать заранее и кэшировать ответ. Последний потенциально снижает на порядок."
    }
  ],
  "estimatedMinutes": 8
}
