{
  "id": "ex-ai1-2",
  "nodeId": "ai1-n1",
  "blockId": "AI1",
  "type": "open",
  "title": "Найти причину плохого ответа",
  "promptBlocks": [
    {
      "type": "paragraph",
      "text": "Для каждого случая скажите, где проблема и что делать."
    },
    {
      "type": "list",
      "items": [
        "Модель называет состав товара, которого нет в описании",
        "Ответы то в одно предложение, то на абзац",
        "Модель отвечает на медицинский вопрос вместо отказа",
        "Модель не знает про товары, добавленные сегодня"
      ],
      "ordered": true
    }
  ],
  "inputs": [],
  "acceptance": [],
  "referenceReasoningBlocks": [
    {
      "type": "paragraph",
      "text": "1 — нет данных в контексте плюс отсутствие разрешения сказать «не знаю»; правка инструкции. 2 — не задан формат; примеры желаемого ответа. 3 — не задано поведение для этого класса вопросов; явное правило в инструкции. 4 — данные не подставляются в контекст; вопрос к сборке промпта, не к модели. Ни в одном случае замена модели не является первым ответом."
    }
  ],
  "estimatedMinutes": 8
}
