{
  "id": "ex-pf2-6",
  "nodeId": "pf2-n6",
  "blockId": "PF2",
  "type": "classification",
  "title": "Оптимизировать или нет",
  "promptBlocks": [
    {
      "type": "paragraph",
      "text": "Для каждого предложения скажите «да» или «нет» и обоснуйте."
    },
    {
      "type": "list",
      "items": [
        "Экран 620 → 450 мс, доля компонента 40%, 1 неделя",
        "Экран 3.4 → 1.6 с, 2 недели",
        "Сокращение трафика на 25%, при затратах на трафик 240 тыс/мес, 1 неделя",
        "Экран 900 мс сейчас, при росте втрое станет 2.6 с, 1 неделя"
      ],
      "ordered": true
    }
  ],
  "inputs": [
    {
      "id": "p1",
      "label": "620 → 450 мс, доля компонента 40%, 1 неделя",
      "type": "choice",
      "choices": [
        "да",
        "нет"
      ]
    },
    {
      "id": "p2",
      "label": "3.4 → 1.6 с, 2 недели",
      "type": "choice",
      "choices": [
        "да",
        "нет"
      ]
    },
    {
      "id": "p3",
      "label": "Трафик −25% при затратах 240 тыс/мес, 1 неделя",
      "type": "choice",
      "choices": [
        "да",
        "нет"
      ]
    },
    {
      "id": "p4",
      "label": "900 мс сейчас, при росте втрое станет 2.6 с",
      "type": "choice",
      "choices": [
        "да",
        "нет"
      ]
    }
  ],
  "acceptance": [
    {
      "inputId": "p1",
      "expected": "нет"
    },
    {
      "inputId": "p2",
      "expected": "да"
    },
    {
      "inputId": "p3",
      "expected": "да"
    },
    {
      "inputId": "p4",
      "expected": "да"
    }
  ],
  "referenceReasoningBlocks": [
    {
      "type": "paragraph",
      "text": "1 — нет, внутри категории «быстро», поведенческого эффекта не будет. 2 — да, переход из «раздражение» в «ожидание». 3 — да, экономия ~720 тыс/год за неделю работы, окупается деньгами независимо от восприятия. 4 — да, растущая проблема, сейчас дешевле. Приём: категория восприятия, поведенческий эффект, деньги, рост — четыре основания, любого достаточно."
    }
  ],
  "estimatedMinutes": 8
}
