{
  "id": "ex-in2-5",
  "nodeId": "in2-n5",
  "blockId": "IN2",
  "type": "classification",
  "title": "Вебхук или опрос",
  "promptBlocks": [
    {
      "type": "paragraph",
      "text": "Выберите механизм и назовите, чем дополните."
    },
    {
      "type": "list",
      "items": [
        "Подтверждение оплаты",
        "Обновление каталога поставщика",
        "Смена статуса доставки",
        "Изменение реквизитов партнёра"
      ],
      "ordered": true
    }
  ],
  "inputs": [
    {
      "id": "e1",
      "label": "Подтверждение оплаты",
      "type": "choice",
      "choices": [
        "вебхук",
        "опрос"
      ]
    },
    {
      "id": "e2",
      "label": "Обновление каталога поставщика",
      "type": "choice",
      "choices": [
        "вебхук",
        "опрос"
      ]
    },
    {
      "id": "e3",
      "label": "Смена статуса доставки",
      "type": "choice",
      "choices": [
        "вебхук",
        "опрос"
      ]
    },
    {
      "id": "e4",
      "label": "Изменение реквизитов партнёра",
      "type": "choice",
      "choices": [
        "вебхук",
        "опрос"
      ]
    }
  ],
  "acceptance": [
    {
      "inputId": "e1",
      "expected": "вебхук"
    },
    {
      "inputId": "e2",
      "expected": "опрос"
    },
    {
      "inputId": "e3",
      "expected": "вебхук"
    },
    {
      "inputId": "e4",
      "expected": "опрос"
    }
  ],
  "referenceReasoningBlocks": [
    {
      "type": "paragraph",
      "text": "1 — вебхук плюс сверка каждые 5 минут, задержка критична, потеря недопустима. 2 — опрос по расписанию, вебхуков у них нет, задержка терпима. 3 — вебхук плюс сверка раз в 15 минут по активным заказам. 4 — опрос раз в сутки, события редки. Везде, где вебхук: проверка подписи обязательна и сверка обязательна, потому что наша недоступность превращается в потерянные события."
    }
  ],
  "estimatedMinutes": 8
}
