{
  "id": "ex-ds3-1",
  "nodeId": "ds3-n1",
  "blockId": "DS3",
  "type": "classification",
  "title": "Обратимо или нет",
  "promptBlocks": [
    {
      "type": "paragraph",
      "text": "Классифицируйте и объясните критерий."
    },
    {
      "type": "list",
      "items": [
        "Сделать поле «комментарий» обязательным",
        "Записывать событие покупки на заказ, а не на каждую позицию",
        "Использовать email как первичный ключ пользователя",
        "Хранить цену целым числом копеек вместо дробного",
        "Считать тенантом филиал, а не всю сеть"
      ],
      "ordered": true
    }
  ],
  "inputs": [
    {
      "id": "d1",
      "label": "Сделать «комментарий» обязательным",
      "type": "choice",
      "choices": [
        "обратимо",
        "необратимо"
      ]
    },
    {
      "id": "d2",
      "label": "Записывать покупку на заказ, а не на позицию",
      "type": "choice",
      "choices": [
        "обратимо",
        "необратимо"
      ]
    },
    {
      "id": "d3",
      "label": "Email как первичный ключ пользователя",
      "type": "choice",
      "choices": [
        "обратимо",
        "необратимо"
      ]
    },
    {
      "id": "d4",
      "label": "Цена целым числом копеек",
      "type": "choice",
      "choices": [
        "обратимо",
        "необратимо"
      ]
    },
    {
      "id": "d5",
      "label": "Тенант — филиал, а не сеть",
      "type": "choice",
      "choices": [
        "обратимо",
        "необратимо"
      ]
    }
  ],
  "acceptance": [
    {
      "inputId": "d1",
      "expected": "обратимо"
    },
    {
      "inputId": "d2",
      "expected": "необратимо"
    },
    {
      "inputId": "d3",
      "expected": "необратимо"
    },
    {
      "inputId": "d4",
      "expected": "обратимо"
    },
    {
      "inputId": "d5",
      "expected": "необратимо"
    }
  ],
  "referenceReasoningBlocks": [
    {
      "type": "paragraph",
      "text": "обратимы 1 и 4 — это работа, данные не теряются. Необратимы 2 (детализации задним числом не будет, история потеряна навсегда), 3 (ключ уходит наружу), 5 (перестраивает всю систему прав и все ссылки). Критерий: теряются ли данные безвозвратно. Объём работы не делает решение необратимым."
    }
  ],
  "estimatedMinutes": 8
}
