{
  "id": "ex-ds3-4",
  "nodeId": "ds3-n4",
  "blockId": "DS3",
  "type": "open",
  "title": "Где сломалась цифра",
  "promptBlocks": [
    {
      "type": "paragraph",
      "text": "DAU упал на 12%. Для каждого наблюдения скажите, о чём оно говорит."
    },
    {
      "type": "list",
      "items": [
        "Число заказов в продуктовой базе не изменилось",
        "Падение видно только на iOS",
        "Падение началось ровно в полночь 14-го",
        "Исторические данные за прошлый год тоже изменились",
        "Падение только в последнем часе и выравнивается"
      ],
      "ordered": true
    }
  ],
  "inputs": [],
  "acceptance": [],
  "referenceReasoningBlocks": [
    {
      "type": "paragraph",
      "text": "1 — продукт в порядке, сломана цифра. 2 — платформенная проблема, скорее всего релиз или SDK. 3 — резкая граница указывает на дрейф схемы или потерю события, а не на поведение людей. 4 — изменилось определение метрики, а не данные. 5 — задержка выгрузки, ждать. Приём: сначала сверяете с продуктовой базой, потом идёте по пути сверху вниз."
    }
  ],
  "estimatedMinutes": 8
}
