{
  "id": "ex-in2-1",
  "nodeId": "in2-n1",
  "blockId": "IN2",
  "type": "classification",
  "title": "Где собирать данные",
  "promptBlocks": [
    {
      "type": "paragraph",
      "text": "Для каждого экрана скажите, где собирать: клиент, сервер, общий ресурс."
    },
    {
      "type": "list",
      "items": [
        "Главный экран, 5 источников, меняется раз в год, максимальная нагрузка",
        "Экран настроек профиля, 3 источника, меняется ежемесячно",
        "Партнёрский API для отчёта сети",
        "Экран эксперимента, живёт 6 недель"
      ],
      "ordered": true
    }
  ],
  "inputs": [
    {
      "id": "s1",
      "label": "Главный экран, 5 источников, максимальная нагрузка",
      "type": "choice",
      "choices": [
        "клиент",
        "сервер",
        "общие ресурсы"
      ]
    },
    {
      "id": "s2",
      "label": "Экран настроек профиля",
      "type": "choice",
      "choices": [
        "клиент",
        "сервер",
        "общие ресурсы"
      ]
    },
    {
      "id": "s3",
      "label": "Партнёрский API для отчёта сети",
      "type": "choice",
      "choices": [
        "клиент",
        "сервер",
        "общие ресурсы"
      ]
    },
    {
      "id": "s4",
      "label": "Экран эксперимента на 6 недель",
      "type": "choice",
      "choices": [
        "клиент",
        "сервер",
        "общие ресурсы"
      ]
    }
  ],
  "acceptance": [
    {
      "inputId": "s1",
      "expected": "сервер"
    },
    {
      "inputId": "s2",
      "expected": "клиент"
    },
    {
      "inputId": "s3",
      "expected": "общие ресурсы"
    },
    {
      "inputId": "s4",
      "expected": "клиент"
    }
  ],
  "referenceReasoningBlocks": [
    {
      "type": "paragraph",
      "text": "1 — сервер, эндпоинт под экран: нагрузка велика, экран стабилен. 2 — клиент из общих ресурсов: меняется часто, нагрузка низкая. 3 — общие ресурсы: сценарии партнёра нам неизвестны. 4 — клиент: эксперимент не должен требовать релиза сервера при каждой правке. Критерий: что меняется чаще — экран или нагрузка на него."
    }
  ],
  "estimatedMinutes": 8
}
