{
  "id": "ex-in1-4",
  "nodeId": "in1-n4",
  "blockId": "IN1",
  "type": "classification",
  "title": "Синхронно или в фон",
  "promptBlocks": [
    {
      "type": "paragraph",
      "text": "Распределите и назовите, что видит человек."
    },
    {
      "type": "list",
      "items": [
        "Применение промокода",
        "Отправка чека на почту",
        "Проверка доступности слота доставки",
        "Формирование отчёта за год",
        "Начисление бонусов за заказ"
      ],
      "ordered": true
    }
  ],
  "inputs": [
    {
      "id": "o1",
      "label": "Применение промокода",
      "type": "choice",
      "choices": [
        "синхронно",
        "в фон"
      ]
    },
    {
      "id": "o2",
      "label": "Отправка чека на почту",
      "type": "choice",
      "choices": [
        "синхронно",
        "в фон"
      ]
    },
    {
      "id": "o3",
      "label": "Проверка доступности слота доставки",
      "type": "choice",
      "choices": [
        "синхронно",
        "в фон"
      ]
    },
    {
      "id": "o4",
      "label": "Формирование отчёта за год",
      "type": "choice",
      "choices": [
        "синхронно",
        "в фон"
      ]
    },
    {
      "id": "o5",
      "label": "Начисление бонусов за заказ",
      "type": "choice",
      "choices": [
        "синхронно",
        "в фон"
      ]
    }
  ],
  "acceptance": [
    {
      "inputId": "o1",
      "expected": "синхронно"
    },
    {
      "inputId": "o2",
      "expected": "в фон"
    },
    {
      "inputId": "o3",
      "expected": "синхронно"
    },
    {
      "inputId": "o4",
      "expected": "в фон"
    },
    {
      "inputId": "o5",
      "expected": "в фон"
    }
  ],
  "referenceReasoningBlocks": [
    {
      "type": "paragraph",
      "text": "синхронно 1 и 3 — без результата нельзя продолжить. В фон 2, 4, 5. Для 4 обязательно предупреждение до нажатия и уведомление после. Для 5 — начисление показывается как «будут начислены в течение часа», иначе человек ищет баллы и идёт в поддержку. Ловушка в 1: делать асинхронным ради скорости экрана — ошибка, человек не понимает, применился код или нет."
    }
  ],
  "estimatedMinutes": 8
}
